{
  "schema_version": 1,
  "kind": "course.list",
  "data": [
    {
      "id": "2",
      "short_name": "CS204",
      "full_name": "Operating Systems",
      "start_date": "2026-09-18T09:27:16Z",
      "end_date": "2027-09-18T09:27:16Z",
      "visible": true,
      "progress": null
    }
  ],
  "meta": {
    "site": "rec",
    "account": "env",
    "source": "ws",
    "partial": false,
    "missing": [],
    "next_cursor": null
  }
}
